KEY	DATA	ACONTECIMENTO	ÂMBITO	VALIDADO	FONTES	LEGENDAS	NOTAS	TIPO	LINK
2009042700	2009-04-27	Instituição da Fundação ISCTE-Instituto Universitário de Lisboa (ISCTE-IUL)	Iscte	sim	Decreto- Lei  95/2009 de 27 abril in Diário da República, n.º 81, I Série, 27/04/2009, pp. 2442-2447 - acessível em https://files.dre.pt/1s/2009/04/08100/0244202447.pdf	Decreto- Lei  95/2009 de 27 abril		documento	https://files.dre.pt/1s/2009/04/08100/0244202447.pdf
2009050800	2009-05-08	Publicação dos Estatutos da Fundação ISCTE-IUL. Consagrados nesta orgânica os Departamentos (Antropologia, Arquitetura, Ciências de Gestão, Ciências de Tecnologias e Informação, Contabilidade, Economia, Finanças, História, Métodos Quantitativos, Psicologia Social e das Organizações e Sociologia e Secção Autónoma de Direito), as Unidades de investigação (Associação para o desenvolvimento das telecomunicações e Técnicas de Informáticas, Centro de Estudos Africanos, Centro de Estudos de Antropologia Social, Centro de Estudos de História Contemporânea Portuguesa, Centro de EStudos Territoriais, Centro de Investigação e Estudos de Sociologia, Centro de Investigação e Intervenção Social, DINAMIA - Centro de Estudos sobre a Mudança Socioeconómica, delegação no ISCTE-IUL do Instituto de Telecomunicações) e Escola de Gestão	Iscte	sim	Despacho Normativo 18/2009, Diário da República nº 89/2009 de 8 maio in Diário da República, n.º 89, II Série, 08/05/2009, pp. 18329-18339 - acessível em https://files.dre.pt/2s/2009/05/089000000/1832918339.pdf	Despacho Normativo 18/2009 de 8 maio		documento	https://files.dre.pt/2s/2009/05/089000000/1832918339.pdf
2009070200	2009-07-02	 Criada a área de Competências Transversais da qual virá a ser responsável o Laboratório de Línguas e Competências Transversais	Iscte	sim	Deliberação nº 131/213 in Diário da República nº. 124, II Série, 01/07/2013, pp. 20711-20712 - acessível em https://files.dre.pt/2s/2013/07/124000000/2071120712.pdf	Deliberação nº 131/213 de 1 de Julho		documento	https://files.dre.pt/2s/2013/07/124000000/2071120712.pdf
2009091100	2009-09-11	Carlos Lopes é eleito presidente do Conselho Geral	Iscte	sim	Deliberação n.º 3209/2009 de 30 de novembro in Diário da República, n.º 232, II Série, 30/11/2009, p. 48841	Eleição de Carlos Lopes para presidente do Conselho Geral		imagem	https://www.flickr.com/photos/iscteiul/52015377665/in/album-72177720298218822/ ; https://files.dre.pt/2s/2009/11/232000000/4884148841.pdf
2009102600	2009-10-26	José António Vieira da Silva, ministro da Economia da Inovação e Desenvolvimento 	Iscte	sim	Decreto do Presidente da República n.o 100-B/2009 de 26 de Outubro in Diário da República, n.º 207, I Série, 26/10/2009, pp. 8040-(2) - acessível em https://files.dre.pt/1s/2009/10/20701/0000200002.pdf	Decreto do Presidente da República n.º 100-B/2009 de 26 de Outubro		documento	https://files.dre.pt/1s/2009/10/20701/0000200002.pdf
2010022000	2010-02-20	Enxurradas na ilha da Madeira (cerca de 50 mortos)	Nacional	sim		Reportagem: O filme das cheias da Madeira		pagina_web	https://ensina.rtp.pt/artigo/o-filme-das-cheias-da-madeira/
2009110600	2009-11-06	Luís Antero Reto é eleito Reitor 	Iscte	sim	Deliberação n.º 3194/2009, de 26 de novembro in Diário da República, n.º 230, II Série, 26/11/2009, p. 48446 - acessível em https://files.dre.pt/2s/2009/11/230000000/4844648446.pdf	Eleição a 06-11-2009; Homologação da eleição do reitor pelo Conselho de Curadores a 13-11-2009, publicada a Deliberação n.º 3194/2009, de 26 de novembro.	Procurar imagem ; 	documento	https://files.dre.pt/2s/2009/11/230000000/4844648446.pdf
2009111300	2009-11-13	António Ramalho Eanes é eleito presidente do Conselho de Curadores 	Iscte	sim	Deliberação n.º 3195/2009, de 26 de novembro in Diário da República, n.º 230, II Série, 26/11/2009, p. 48446 - acessível em https://files.dre.pt/2s/2009/11/230000000/4844648446.pdf	Deliberação n.º 3195/2009, de 26 de novembro		documento	https://files.dre.pt/2s/2009/11/230000000/4844648446.pdf
2010042600	2010-04-26	Primeiro doutoramento em Serviço Social, Jorge Ferreira	Iscte	sim	Unidade de Apoio ao 3.º Ciclo				
2010061800	2010-06-18	Criação da Escola de Ciências Sociais e Humanas (ECSH), de Escola de Sociologia e Políticas Públicas (ESPP), da Escola de Tecnologias e Arquitetura (ISTA) e da Escola de Gestão (IBS)	Iscte	sim	Deliberação nº 1069/2010 in Diário da República, n.º 117, II Série, 18/06/2010, pp. 33414	Deliberação nº 1069/2010 de 18 de junho		imagem	https://www.flickr.com/photos/iscteiul/52014864536/in/album-72177720298218822/
2010070100	2010-07-01	António Gomes Mota é diretor da Escola de Gestão (IBS)	Iscte	sim	Termo de Posse a 01-07-2010.				
2010070101	2010-07-01	Francisco Cercas é diretor da Escola de Tecnologias e Arquitetura (ISTA)	Iscte	sim	Termo de Posse a 01-07-2010.	Termo de posse		imagem	https://www.flickr.com/photos/iscteiul/52015377580/in/album-72177720298218822/
2010070102	2010-07-01	Luísa Lima é Diretora da Escola de Ciências Sociais e Humanas (ECSH) 	Iscte	sim	Termo de Posse a 01-07-2010.	Termo de posse		imagem	https://www.flickr.com/photos/iscteiul/52015377610/in/album-72177720298218822/
2010070103	2010-07-01	Juan Mozzicafreddo (✝︎) é diretor da Escola de Sociologia e Políticas Públicas (ESPP) 	Iscte	sim	Termo de Posse a 01-07-2010.	Termo de posse		imagem	https://www.flickr.com/photos/iscteiul/52015377630/in/album-72177720298218822/
2010090100	2010-09-01	Desmaterialização dos sumários das aulas	Iscte	não	Prof. Jorge Freitas Branco				
2010093000	2010-09-30	Número de estudantes: 9542	Iscte	sim	Serviços de Gestão do Ensino 				
2010110200	2010-11-02	Consagrada na nova orgânica os departamentos (Antropologia, Arquitetura e Urbanismo, Ciência Política e Políticas Públicas, Ciências e Tecnologias da Informação, Contabilidade, Economia, Economia Política, Finanças, História, Marketing Operações e Gestão Geral, Métodos de Pesquisa Social, Métodos Quantitativos, Psicologia Social e das Organizações, Recursos Humanos e Comportamento Organizacional e Sociologia), as Unidades de Investigação (Centro de EStudos Africanos, Centro de Estudos de História Contemporânea, Centro de Estudos sobre a Mudança Socioeconómica e o Território, Centro de Investigação e Intervenção Social, Centro de Investigação e Estudos de Sociologia, Centro de Investigação em Sistemas e Tecnologias de Informação Avançados e Pólo do ISCTE do Centro em Rede em Investigação em Antropologia e Unidade de Investigação e Desenvolvimento Empresarial) e as Escolas (Escola de Ciências Sociais e Humanas, Escola de Gestão, Escola de Sociologia e Políticas Públicas, Escola de Tecnologias e Arquitetura)	Iscte	sim	Deliberação 1971/2010 -DR-212/2010 in Diário da República, n.º 212, II Série, 02/11/2010, p. 54333 - acessível em https://dre.pt/dre/detalhe/deliberacao/1971-2010-2596659	Deliberação 1971/2010 de 2 novembro		documento	https://files.dre.pt/2s/2010/11/212000000/5433354333.pdf
2010110201	2010-11-02	Regulamento de Avaliação de Desempenho dos Docentes do ISCTE-IUL	Iscte	sim	Despacho nº. 16623/2010 in Diário da República, n.º 212, II Série, 02/11/2010, p. 54339 - acessível em https://files.dre.pt/2s/2010/11/212000000/5433954347.pdf	Despacho nº. 16623/2010 de 2 de Novembro		documento	https://files.dre.pt/2s/2010/11/212000000/5433954347.pdf
2010123100	2010-12-31	Criação da Editora Mundos Sociais neste ano	Iscte	sim	Livro editado em 2010  - acessível em https://www.slab.pt/observatoriodasdesigualdades/2010/01/01/desigualdades-sociais-2010-estudos-e-indicadores/	Página web da Editora Mundos Sociais		pagina_web	https://mundossociais.com
2011031100	2011-03-11	Acidente nuclear na central de Fukushima, Japão	Internacional	sim		Explicação do acidente nuclear de Fukushima (Vídeo)		video	https://www.youtube.com/watch?v=MfE8co6MX2w
2011011800	2011-01-18	Susana Fonseca é presidente do Conselho Pedagógico (eleita)	Iscte	sim	Termo de Posse a 18-01-2011.				
2011030100	2011-03-01	Automatização plena das inscrições do 2º ciclo	Iscte	não	Prof. Jorge Freitas Branco				
2011040600	2011-04-06	Troika foi chamada a Portugal	Nacional	sim		Video: Há 10 anos atrás, José Sócrates anunciava que ia chamar a Troika		video	https://www.youtube.com/watch?v=8klYt4SqTMk&t=4s
2011032000	2011-03-20	Doutoramento Honoris Causa atribuído a Wei Zhao na Academia de Ciências de Lisboa (pelo ISCTE em associação com UTL, Porto, NOVA, Aveiro, Minho, Évora, Açores, Algarve, UTAD, UBI, Madeira)	Iscte	sim	Unidade de apoio ao 3º ciclo	Cerimónia de atribuição de Doutoramento Honoris Causa a Wei Zhao		pagina_web	https://www.um.edu.mo/pt-pt/news-and-press-releases/press-release/detail/15850/
2011032100	2011-03-21	Isabel Vieira Nicolau, Provedora do Estudante	Iscte	sim	Despacho n.º 5910/2011, de 05 de abril.	Isabel Vieira Nicolau, Provedora do Estudante		imagem	https://www.flickr.com/photos/iscteiul/52015112999/in/album-72177720298218822/
2011041500	2011-04-15	Elaboração do Regulamento da Comissão de Ética do ISCTE-IUL	Iscte	sim	Despacho n.º 7095/2011 in Diário da República, n.º 90, II Série, 10/05/2011, pp. 20178-20179 - acessível em https://files.dre.pt/2s/2011/05/090000000/2017820179.pdf	Despacho n.º 7095/2011. 		documento	https://files.dre.pt/2s/2011/05/090000000/2017820179.pdf
2011042700	2011-04-27	Doutoramento Honoris Causa atribuído a André Jordan	Iscte	sim	Fotografia do evento	Cerimónia de atribuição de Doutoramento Honoris Causa a André Jordan		imagem	https://www.flickr.com/photos/iscteiul/5669815020/in/photostream/
2011051700	2011-05-17	Assinatura do Memorando de Entendimento entre a "Troika" e Portugal	Nacional	sim		Tradução do conteúdo do "Memorando de Entendimento sobre as Condicionalidades de Política Económica"		documento	https://www.bportugal.pt/sites/default/files/anexosmou_pt.pdf
2011042701	2011-04-27	Doutoramento Honoris Causa atribuído a José Veiga Simão ✝︎	Iscte	sim	Fotografia do evento	Cerimónia de atribuição de Doutoramento Honoris Causa a José Veiga Simão ✝︎		imagem	https://www.flickr.com/photos/iscteiul/52015113094/in/album-72177720298218822/
2011051600	2011-05-16	Conselho Geral extingue a Fundação ISCTE	Iscte	não	Prof. Jorge Freitas Branco				
2011072700	2011-07-27	Criação do Doutoramento em Ciências da Complexidade, em associação com a Faculdade de Ciências da Universidade de Lisboa 	Iscte	sim	Despacho n.º 9318/2011 in Diário da República, n.º 143, II Série, 27/07/2011, pp. 31166-31168 - acessível em https://files.dre.pt/2s/2011/07/143000000/3116631168.pdf	Despacho n.º 9318/2011 de 27 de julho		documento	https://files.dre.pt/2s/2011/07/143000000/3116631168.pdf
2011080200	2011-08-02	Criação do Doutoramento em Contabilidade	Iscte	sim	Deliberação n.o 1390/2011 in Diário da República nº 147, II série, O2/08/2011, pp. 31809- 31811 - acessível em https://files.dre.pt/2s/2011/08/147000000/3180931811.pdf	Deliberação n.o 1390/2011 de 2 de agosto		documento	https://files.dre.pt/2s/2011/08/147000000/3180931811.pdf
2011080900	2011-08-09	Criação do Doutoramento em Gestão e Desenvolvimento de Recursos Humanos	Iscte	sim	Deliberação n.º 1432/2011 in Diário da República, n.º 152/2011, II Série, 09/08/2011, p. 32872 - acessível em https://files.dre.pt/2s/2011/08/152000000/3286832872.pdf	Deliberação n.º 1431/2011, de 9 de agosto		documento	https://files.dre.pt/2s/2011/08/152000000/3286832872.pdf
2011080901	2011-08-09	Criação do Doutoramento em Finanças	Iscte	sim	Deliberação n.º 1431/2011 in Diário da República, n.º 152/2011, II Série, 09/08/2011, pp. 32864-32868 - acessível em https://files.dre.pt/2s/2011/08/152000000/3286832872.pdf	Deliberação n.º 1431/2011, de 9 de agosto		documento	https://files.dre.pt/2s/2011/08/152000000/3286832872.pdf
2011080902	2011-08-09	Criação do Doutoramento em Gestão de Operações e da Tecnologia	Iscte	sim	Deliberação n.º 1431/2011 in Diário da República, n.º 152/2011, II Série, 09/08/2011, pp. 32868-32872 - acessível em https://files.dre.pt/2s/2011/08/152000000/3286832872.pdf	Deliberação n.º 1431/2011 de 9 de agosto		documento	https://files.dre.pt/2s/2011/08/152000000/3286832872.pdf
2011081100	2011-08-11	Criação do Doutoramento em Métodos Quantitativos Aplicados	Iscte	sim	Deliberação n.º 1464/2011 in Diário da República, n.º 154/2011, II Série, 11/08/2011, pp. 33184-33186 - acessível em https://files.dre.pt/2s/2011/08/154000000/3318433186.pdf	Deliberação n.º 1464/2011 de 11 de agosto		documento	https://files.dre.pt/2s/2011/08/154000000/3318433186.pdf
2011081101	2011-08-11	Criação do Doutoramento em Métodos Quantitativos	Iscte	sim	Deliberação n.º 1465/2011 de 11 de agosto, Diário da República n.º 154/2011, Série II, 2011-08-11, pp. 33186-33190 - acessível em https://files.dre.pt/gratuitos/2s/2011/08/2S154A0000S00.pdf	Deliberação n.º 1465/2011 de 11 de agosto		documento	https://files.dre.pt/gratuitos/2s/2011/08/2S154A0000S00.pdf
2011081102	2011-08-11	Criação do Doutoramento em Políticas Públicas	Iscte	sim	Deliberação n.º 1466/2011 in Diário da República n.º 154/2011, Série II, pp. páginas 33191 - 33193 de 11-08-2011 - acessível em https://files.dre.pt/gratuitos/2s/2011/08/2S154A0000S00.pdf	Deliberação n.º 1466/2011 de 11 de agosto		documento	https://files.dre.pt/gratuitos/2s/2011/08/2S154A0000S00.pdf
2011081103	2011-08-11	Criação do Doutoramento em Marketing	Iscte	sim	Deliberação nº 1467/2011, Diário da República, n.º 154/2011, Série II, de 2011-08-11, pp. 33193 - 33197 - acessível em https://files.dre.pt/2s/2011/08/154000000/3319333197.pdf	Deliberação nº 1467/2011 de 11 de agosto		documento	https://files.dre.pt/2s/2011/08/154000000/3319333197.pdf
2011081200	2011-08-12	Criação do Doutoramento em Gestão Geral, Estratégia e Desenvolvimento Empresarial	Iscte	sim	Deliberação n.º 1502/2011 in Diário da República, n.º 155/2011, II Série II, 12/08/2011, pp. 33373-33377 - acessível em https://files.dre.pt/2s/2011/08/155000000/3337333377.pdf	Deliberação n.º 1502/2011, de 12 de agosto		documento	https://files.dre.pt/2s/2011/08/155000000/3337333377.pdf
2011090900	2011-09-09	Symposium Digital Fabricatio​n – a State of Art no ISCTE-IUL	Iscte	não	Prof. Jorge Freitas Branco		Informação presencial da Arq. Maria Helena Teixeira. Não tem informação sobre os eventos, sugeriu que se enviasse para a Reitoria. Pedido reencaminhado por email e pessoalmente. Ainda não recebemos informação de Ana Duarte Pereira. Na minha opinião aguardar e reforçar dentro de uns dias.	imagem	https://www.flickr.com/photos/iscteiul/52014910598/in/album-72177720298218822/
2011091000	2011-09-10	Criação do Vitruvius FABLAB	Iscte	não	Gabinete da Reitora?? Despacho nº 19/2013 do reitor do ISCTE- IUL. Nomeação da Comissão de Gestão do Vitruvius-FabLab-IUL		Informação reitoria (2 fontes) "Despacho nº 19/2013 do reitor do ISCTE- IUL. Nomeação da Comissão de Gestão do Vitruvius-FabLab-IUL." de 17 de maio de 2013. na minha opinião deve ser validado, esta informação foi prestada por Ana Duarte Pereira a 20 dez		
2011110200	2011-11-02	Aprovação do Manual da Qualidade 	Iscte	sim	Despacho nº 103/2011 do Reitor do ISCTE-IUL, 02/11/2011				
2011123100	2011-12-31	Criação do Instituto para as Políticas Públicas e Sociais (IPPS- IUL) neste ano	Iscte	sim	https://www.iscte-iul.pt/conteudos/iscte/quem-somos/12/historia-iscte	Instituto para as Políticas Públicas		pagina_web	https://www.iscte-iul.pt/conteudos/iscte/quem-somos/12/historia-iscte
2011123101	2011-12-31	Criada a revista Portuguese Journal of Quantitative Methods neste ano	Iscte	sim	https://catalogo.biblioteca.iscte-iul.pt/cgi-bin/koha/opac-detail.pl?biblionumber=70630	Portuguese Journal of Quantitative Methods		pagina_web	https://catalogo.biblioteca.iscte-iul.pt/cgi-bin/koha/opac-detail.pl?biblionumber=70630
2011123102	2011-12-31	Criação do Portal I-Meritus para a avaliação do desempenho dos docentes e dos investigadores; (https://i-meritus.iscte-iul.pt)	Iscte	sim	"Relatório de Avaliação de Desempenho dos Docentes do ISCTE-IUL, Triénio 2011-2013", maio/2014, p. 6				
2012011600	2012-01-16	Homologação da compra do edifício do Instituto da Mobilidade e dos Transportes Terrestres (IMTT)	Iscte	não	Prof. Jorge Freitas Branco				
2012052900	2012-05-29	Extinção da Fundação ISCTE (continua como IPPS)	Iscte	não	Prof. Jorge Freitas Branco		IPPS - ir à página; não há informação; enviado e-mail. Enviado email ao IPPS, sem resposta. Não validar (opinião)		
2012053100	2012-05-31	Desmaterialização do Inquérito de monitorização pedagógica (2º ciclo)	Iscte	não	Prof. Jorge Freitas Branco				
2012060200	2012-06-02	Claque do ISCTE (500 participantes) no jogo da seleção portuguesa contra a seleção turca	Iscte	sim	Informações orais cruzadas				
2012073000	2012-07-30	Criação do Doutoramento em Estudos Urbanos em associação com a Faculdade de Ciências e Humanas da Universidade Nova de Lisboa	Iscte	sim	Regulamento n.º 302/2012 in Diário da República, n.º 146/2012, II Série II, 30/07/2012, pp. 26878-26881 - acessível em https://files.dre.pt/2s/2012/07/146000000/2687826881.pdf	Regulamento n.º 302/2012, de 30 de julho		documento	https://files.dre.pt/2s/2012/07/146000000/2687826881.pdf
2012073100	2012-07-31	Criação do Doutoramento em Ciência Política	Iscte	sim	Regulamento n.º 306/2012 in Diário da República n.º 147/2012, Série II de 2012-07-31, 26947-26965 - acessível em https://files.dre.pt/2s/2012/07/147000000/2694726950.pdf	Regulamento n.º 306/2012 de 31 de julho		documento	https://files.dre.pt/2s/2012/07/147000000/2694726950.pdf
2012073101	2012-07-31	Criação do Doutoramento em Ciências da Comunicação	Iscte	sim	Regulamento n.º 309/2012 in Diário da República n.º 147/2012, Série II de 2012-07-31, pp. 26955-26957 - acessível em https://dre.pt/dre/detalhe/regulamento/309-2012-1436096	Regulamento n.º 309/2012 de 31 de julho		pagina_web	https://dre.pt/dre/detalhe/regulamento/309-2012-1436096
2012101300	2012-10-13	Manifestação popular "Que se lixe a Troika!"	Nacional	sim		Wikipédia: Que se lixe a troika! Queremos as nossas vidas!		pagina_web	https://pt.wikipedia.org/wiki/Que_se_lixe_a_troika!_Queremos_as_nossas_vidas!
2012102600	2012-10-26	Jorge Barreto Xavier, Secretário de Estado da Cultura	Nacional	sim	Decreto do Presidente da República n.o 159-B/2012 de 26 Outubro, in Diário da República, n.º 208, I Série, 26/10/2012, p. 6218-(2)	Decreto do Presidente da República n.o 159-B/2012 de 26 Outubro		documento	https://files.dre.pt/1s/2012/10/20801/0000200002.pdf
2012091200	2012-09-12	Doutoramento Honoris Causa atribuído a Fernando Henrique Cardoso	Iscte	sim	Fotografia do evento	Cerimónia de atribuição de Doutoramento Honoris Causa a Fernando Henrique Cardoso		imagem	https://www.flickr.com/photos/iscteiul/52015631840/in/album-72177720298221622/
2012101200	2012-10-12	Doutoramento Honoris Causa atribuido a Manuel Marín ✝︎	Iscte	sim	Fotografia do evento	Cerimónia de atribuição de Doutoramento Honoris Causa a Manuel Marín ✝︎		imagem	https://www.flickr.com/photos/iscteiul/52014087652/in/album-72177720298221622/
2012103100	2012-10-31	Criação do Departamento de Matemática	Iscte	sim	Deliberação 1530/2012 in Diário da República, n.º 211, II Série, 31/10/2012, pp. 36009-36010 - acessível em https://files.dre.pt/2s/2012/10/211000000/3600936010.pdf	Deliberação 1530/2012 de 31 outubro		documento	https://files.dre.pt/2s/2012/10/211000000/3600936010.pdf
2012103101	2012-10-31	Criação do Departamento de Métodos Quantitativos para Gestão e Economia (redenominação de Departamento de Métodos Quantitativos)	Iscte	sim	Deliberação 1530/2012-DR 212/2012 in Diário da República, n.º 211, II Série, 31/10/2012, pp. 36009-36010 - acessível em https://files.dre.pt/2s/2012/10/211000000/3600936010.pdf	Deliberação 1530/2012 de 31 outubro		documento	https://files.dre.pt/2s/2012/10/211000000/3600936010.pdf
2012112000	2012-11-20	Mohamed Azzim Gulamhussen é presidente da escola de Gestão (IBS)	Iscte	sim	Termo de Posse a 20-11-2012.				
2012112000	2012-11-20	Mohamed Azzim Gulamhussen é presidente da escola de Gestão (IBS)	Iscte	sim	Termo de Posse a 20-11-2012.				
2012112600	2012-11-26	Victor Franco é presidente do Conselho Científico (eleito)	Iscte	sim	Termo de Posse a 26-11-2012.				
2012121500	2012-12-15	Comemoração dos 40 anos. Publicação do livro “Até onde nos leva o saber. Uma história dos 40 anos do ISCTE Instituto Universitário de Lisboa” (Carlos Oliveira Santos)	Iscte	sim	Santos, Carlos Oliveira, “Até onde nos leva o saber. Uma história dos 40 anos do ISCTE Instituto Universitário de Lisboa”, ISCTE-Instituto Universitário de Lisboa, 2012 - acessível em https://www.google.com/url?q=https://catalogo.biblioteca.iscte-iul.pt/cgi-bin/koha/opac-detail.pl?biblionumber%3D82908&sa=D&source=editors&ust=1672223769415849&usg=AOvVaw3GYDKvDvhgsCAhVFjPzimV	Santos, Carlos Oliveira, “Até onde nos leva o saber. Uma história dos 40 anos do ISCTE Instituto Universitário de Lisboa”, 2012		imagem	https://www.flickr.com/photos/iscteiul/52014086702/in/album-72177720298221622/
2012121501	2012-12-15	Clube ISCTE institui o mural solidário	Iscte	sim	 https://muralsolidario.iscte-iul.pt; https://www.flickr.com/photos/iscteiul/52014087462/in/album-72177720298221622/; 	Mural solidário ISCTE-IUL	Pode haver melhor fonte como o site dos Alumni	imagem	https://www.flickr.com/photos/iscteiul/52014087462/in/album-72177720298221622/; https://muralsolidario.iscte-iul.pt
2012121502	2012-12-15	Emissão da Medalha dos 40 anos	Iscte	sim	https://www.flickr.com/photos/iscteiul/52014086972/in/album-72177720298221622/	Medalha comemorativa do 40º aniversário do ISCTE		imagem	https://www.flickr.com/photos/iscteiul/52014086972/in/album-72177720298221622/
2013070100	2013-07-01	União Europeia: adesão da Croácia 	Internacional	sim		Vídeo: Tratado de adesão da Croácia à UE aprovado pelos eurodeputados		video	https://www.youtube.com/watch?v=lxfDjbkbMrg
2013020400	2013-02-04	Desmaterialização do registo da assiduidade e sumários (docente e discente)	Iscte	não	Prof. Jorge Freitas Branco			imagem	https://www.flickr.com/photos/iscteiul/52015630805/in/album-72177720298221622/
2013030600	2013-03-06	José Luís Saldanha eleito Presidente do Conselho Pedagógico	Iscte	sim	Termo de Posse a 06-03-2013. 				
2013070800	2013-07-08	Filipe Reis é diretor da Escola de Ciências Sociais e Humanas (ECSH)	Iscte	sim	Termo de Posse a 08-07-2013.				
2013071200	2013-07-12	Helena Carvalho é diretora da Escola de Sociologia e Políticas Públicas (ESPP)	Iscte	sim	Termo de Posse a 12-07-2013.				
2013080800	2013-08-08	Criação do Centro de Estudos Internacionais (CEI-IUL), ex-Centro de Estudos Africanos	Iscte	sim	Deliberação de n.º 1567/2013 in Diário da República, n.º 152, II Série, 08/08/2013, pp. 25131-25132 - acessível em https://files.dre.pt/2s/2013/08/152000000/2513125132.pdf	Deliberação de n.º 1567/2013 de 8 de agosto		documento	https://files.dre.pt/2s/2013/08/152000000/2513125132.pdf
2013091300	2013-09-13	Carlos Lopes é reeleito presidente do Conselho Geral	Iscte	sim	Deliberação n.º 1754/2013 in Diário da República, n.º 187, II Série, 27/09/2013, pp. 29674-29675				
2013091800	2013-09-18	Ricardo Fonseca é diretor da Escola de Tecnologias e Arquitetura (ISTA)	Iscte	sim	Termo de Posse a 18-09-2013.				
2013100800	2013-10-08	José Manuel Rebelo é presidente do Conselho Científico (eleito)	Iscte	sim	Termo de Posse a 08-10-2013.	termo de posse		imagem	https://www.flickr.com/photos/iscteiul/52014087342/in/album-72177720298221622/
2013110400	2013-11-04	Primeiro doutoramento em Gestão Empresarial Aplicada, no âmbito do acordo com a University of Electronic Sciences and Technology of China, Chengdu, China, Shen Jun	Iscte	sim	Unidade de Apoio ao 3º. Ciclo				
2013111100	2013-11-11	Plataforma de gestão curricular de investigação Ciência-IUL	Iscte	não	Prof. Jorge Freitas Branco			pagina_web	https://ciencia.iscte-iul.pt
2013111100	2013-11-11	Plataforma de gestão curricular de investigação Ciência-IUL	Iscte	não	Prof. Jorge Freitas Branco			imagem	https://www.flickr.com/photos/iscteiul/52015115186/in/album-72177720298221622/
2014031800	2014-03-18	Ocupação da Crimeia pela Federação Russa	Internacional	sim		Imagens de assinatura da anexação da Crimeia		video	https://www.youtube.com/watch?v=5ws2wX9NVrA
2014043000	2014-04-30	Medidas de combate a todas as formas de violência escolar	Nacional	sim		Diário da República, 1.ª série — N.º 95 — 19 de maio de 2014		documento	https://files.dre.pt/1s/2014/05/09500/0288202882.pdf
2014030600	2014-03-06	Luís Antero Reto é Reitor (reeleito)	Iscte	sim	Deliberação n.º 59/2014, de 17 de janeiro. Termo de Posse a 06-03-2014.	Deliberação n.º 59/2014, de 17 de janeiro		imagem	https://www.flickr.com/photos/iscteiul/52015164233/in/album-72177720298221622/
2014031300	2014-03-13	Criação do Doutoramento em Estudos de Comunicação: Tecnologia, Cultura e Sociedade em Associação com a Universidade do Minho, a Cooperativa de Formação e Animação Cultural e a Universidade da Beira Interior	Iscte	sim	Despacho n.º 3951/2014 in Diário da República n.º 51/2014, II Série, 13/03/2014, pp. 7027-7028, 05/06/2014 - acessível em https://files.dre.pt/2s/2014/03/051000000/0702707028.pdf	Despacho n.º 3951/2014, de 13 de março		documento	https://files.dre.pt/2s/2014/03/051000000/0702707028.pdf
