KEY	DATA	ACONTECIMENTO	ÂMBITO	VALIDADO	FONTES	LEGENDAS	NOTAS	TIPO	LINK
2001032000	2001-03-20	Criação do Doutoramento em Direito de Empresas	Iscte	sim	Despacho n.º 5503/2001 in Diário da República, n.º 67, II Série, 20/03/2021, p 4955 - acessível em https://files.dre.pt/2s/2001/03/067000000/0495504955.pdf	Despacho n.º 5503/2001 (2.ª série), de 20 de março		documento	https://files.dre.pt/2s/2001/03/067000000/0495504955.pdf
2001091100	2001-09-11	Dois aviões de passageiros colidem com as torres World Trade Center, em Nova Iorque, provocando o seu desmoronamento. Um terceiro avião despenha-se sobre o edifício do Pentágono e um quarto cai em Somerset County, no estado da Pensilvânia	Internacional	sim		11 de Setembro		video	https://www.youtube.com/watch?v=_t3k2WlLgOg
2001091100	2001-09-11	Dois aviões de passageiros colidem com as torres World Trade Center, em Nova Iorque, provocando o seu desmoronamento. Um terceiro avião despenha-se sobre o edifício do Pentágono e um quarto cai em Somerset County, no estado da Pensilvânia	Internacional	sim		11 de Setembro - Queda das Torres Gémeas em Direto na TVI (2001)		video	https://www.youtube.com/watch?v=qnYc-ZEp4Hg
2001091100	2001-09-11	Dois aviões de passageiros colidem com as torres World Trade Center, em Nova Iorque, provocando o seu desmoronamento. Um terceiro avião despenha-se sobre o edifício do Pentágono e um quarto cai em Somerset County, no estado da Pensilvânia	Internacional	sim		Vídeo: 9/11 - As events unfold		video	https://www.youtube.com/watch?v=EEogeIIOJzU
2001091700	2001-09-17	Criação do grupo estudantil de teatro mISCuTEm	Iscte	sim	Conversa da Biblioteca "mISCuTEm - 10 anos", Biblioteca do ISCTE-IUL,12/5/2011 	Grupo de teatro MISCUTEM (fundadora Ana Isabel Augusto)		imagem	https://www.flickr.com/photos/iscteiul/52012208422/in/album-72177720298200772/
2002010100	2002-01-01	Euro entra em circulação em Portugal	Internacional	sim		Vídeo: Uma breve história do euro		video	https://www.youtube.com/watch?v=p2x5Fj3xOHE
2002040600	2002-04-06	Luís Filipe Pereira, ministro da Saúde	Iscte	sim	Decreto do Presidente da República n.º 24-C/2002 de 6 de Abril	Decreto do Presidente da República n.o 24-C/2002 de 6 de Abril		documento	https://files.dre.pt/1s/2002/04/081a01/00020003.pdf
2002051700	2002-05-17	Formalização do Centro de informática (CIISCTE)	Iscte	não	Prof. Jorge Freitas Branco				
2002052000	2002-05-20	Independência de Timor Leste	Internacional	sim		Vídeo: "Timor-Leste celebra 20 anos de independência"		video	https://www.youtube.com/watch?v=ciMVbY3zSc0
2002060100	2002-06-01	Edifício II: Inauguração do Grande Auditório (500 lugares)	Iscte	sim	Ferreira, Raúl Hestnes, "Arquitetura e Universidade- ISCTE", Lisboa, Librus Publicações Técnicas, 2006,  p. 192 - acessível em https://catalogo.biblioteca.iscte-iul.pt/cgi-bin/koha/opac-detail.pl?biblionumber=44777	Ferreira, Raúl Hestnes, "Arquitetura e Universidade- ISCTE", 2006		pagina_web	https://catalogo.biblioteca.iscte-iul.pt/cgi-bin/koha/opac-detail.pl?biblionumber=44777
2002060101	2002-06-01	Entrada em funcionamento do Edifício II  (30.501 m2)	Iscte	sim	Ferreira, Raúl Hestnes, "Arquitetura e Universidade- ISCTE", Lisboa, Librus Publicações Técnicas, 2006,  p.192 - acessível em https://catalogo.biblioteca.iscte-iul.pt/cgi-bin/koha/opac-detail.pl?biblionumber=44777	Ferreira, Raúl Hestnes, "Arquitetura e Universidade- ISCTE", 2006		pagina_web	https://catalogo.biblioteca.iscte-iul.pt/cgi-bin/koha/opac-detail.pl?biblionumber=44777
2002092500	2002-09-25	Criação do Doutoramento em Arquitetura e Urbanismo	Iscte	sim	Despacho n.º 20917/2002 in Diário da República n.º 222/2002, Série II, 25/09/2002, pp. 16262-16263	Despacho n.º 20917/2002 de 25 de setembro		documento	https://files.dre.pt/2s/2002/09/222000000/1626216263.pdf
2002111800	2002-11-18	Primeiro doutoramento em Estudos Africanos Interdisciplinares em Ciências Sociais, Vitor Hugo Nicolau	Iscte	sim	Unidade de Apoio ao 3.º Ciclo				
2002112600	2002-11-26	Albino Lopes é Presidente do Conselho Científico (eleito)	Iscte	sim	Termo de Posse a 26-11-2002.				
2002121900	2002-12-19	Mário Leston Bandeira é Presidente do Conselho Pedagógico (reeleito)	Iscte	sim	Termo de Posse a 19-12-2002				
2002123100	2002-12-31	Criada a revista Portuguese Journal of Social Science neste ano	Iscte	sim	https://catalogo.biblioteca.iscte-iul.pt/cgi-bin/koha/opac-detail.pl?biblionumber=62587	Revista Portuguesa Journal of Social Science		pagina_web	https://catalogo.biblioteca.iscte-iul.pt/cgi-bin/koha/opac-detail.pl?biblionumber=62587
2002123101	2002-12-31	Criada a Revista Portuguesa e Brasileira de Gestão, que sucede à Revista Portuguesa de Gestão neste ano	Iscte	sim	https://bibliotecadigital.fgv.br/ojs/index.php/rbpg/issue/view/4383	Revista Portuguesa e Brasileira de Gestão		pagina_web	https://bibliotecadigital.fgv.br/ojs/index.php/rbpg/issue/view/4383
2002123101	2002-12-31	Criada a Revista Portuguesa e Brasileira de Gestão, que sucede à Revista Portuguesa de Gestão neste ano	Iscte	sim	https://catalogo.biblioteca.iscte-iul.pt/cgi-bin/koha/opac-detail.pl?biblionumber=62552	Revista Portuguesa e Brasileira de Gestão		pagina_web	https://catalogo.biblioteca.iscte-iul.pt/cgi-bin/koha/opac-detail.pl?biblionumber=62552
2002123102	2002-12-31	Criada a revista Trajectos. Revista de Comunicação, Cultura e Educação neste ano	Iscte	sim	https://catalogo.biblioteca.iscte-iul.pt/cgi-bin/koha/opac-detail.pl?biblionumber=62575	Revista Trajectos. Revista de Comunicação, Cultura e Educação	Procurar revista	pagina_web	https://catalogo.biblioteca.iscte-iul.pt/cgi-bin/koha/opac-detail.pl?biblionumber=62575
2002123103	2002-12-31	Negociações para a passagem do Iscte a Universidade Metropolitana (aprovada pelo XIV mas não homologada) neste ano	Iscte	sim					
2003032000	2003-03-20	Segunda Guerra do Golfo	Internacional	sim		Imagens da invasão do Iraque		video	https://www.youtube.com/watch?v=pC6X5pgwdRU
2003042400	2003-04-24	Medidas de enquadramento das praxes académicas	Nacional	sim	Resolução da Assembleia da República n.o 31/2003, Diário da República n.º 96 de 24 de Abril, I. Série A, pp. 2659 	Diário da República, 1.ª série — N.º 96 — 24 de abril de 2013		documento	https://files.dre.pt/1s/2003/04/096a00/26592659.pdf
2003011500	2003-01-15	Criação da Licenciatura em Engenharia Informática	Iscte	sim	Deliberação n.º 627/2003 - Diário da República n.º 105/2003, Série II de 07/05/2003, pp. 6977 - acessível em https://files.dre.pt/2s/2003/05/105000000/0697706980.pdf	Deliberação n.º 627/2003 de 7 de maio		documento	https://files.dre.pt/2s/2003/05/105000000/0697706980.pdf
2003090500	2003-09-05	Criação do Doutoramento em Antropologia Urbana em associação com a Universidade Rovira i Virgili em Tarragona	Iscte	sim	Despacho 17 199/2003 5 de Setembro in Diário da República, n.º 205, II Série, 05/09/2003, pp. 13788-13789 - acessível em https://files.dre.pt/2s/2003/09/205000000/1378813789.pdf	Despacho 17 199/2003 de 5 de Setembro		documento	https://files.dre.pt/2s/2003/09/205000000/1378813789.pdf
2003102100	2003-10-21	Greve nacional estudantil contra as propinas	Nacional	sim		Notícia: Greve nacional contra as propinas mobiliza alunos de todo o país		pagina_web	https://www.publico.pt/2003/10/21/portugal/noticia/greve-nacional-contra-as-propinas-mobiliza-alunos-de-todo-o-pais-1171834
2003102200	2003-10-22	Declaração de Berlim sobre acesso aberto ao conhecimento nas ciências e humanidades	Internacional	sim		Repositório UMInho: Declaração de Berlim sobre Acesso ao Conhecimento nas Ciências e Humanidades 		pagina_web	https://repositorium.sdum.uminho.pt/about/DeclaracaoBerlim.htm
2003091500	2003-09-15	António Gomes Mota é presidente da Escola de Gestão (eleito)	Iscte	sim	Termo de Posse a 15-09-2003.				
2003102800	2003-10-28	Doutoramento Honoris Causa atribuído a Serge Moscovici ✝︎	Iscte	sim	Santos, Carlos Oliveira, Luísa Tiago de Oliveira e Jorge Freitas Branco (orgs.), "ISCTE 35 anos. Nascido para inovar", Lisboa, ISCTE, 2007, p. 72 - acessível em https://repositorio.iscte-iul.pt/handle/10071/2157	Cerimónia de atribuição de Doutoramento Honoris Causa a Serge Moscovici			
2003123100	2003-12-31	Praça central (2.315 m2) fica pronta neste ano	Iscte	sim	Ferreira, Raúl Hestnes, "Arquitetura e Universidade-ISCTE", Lisboa, Librus Publicações Técnicas, 2006, p.192. - acessível em https://catalogo.biblioteca.iscte-iul.pt/cgi-bin/koha/opac-detail.pl?biblionumber=44777	Ferreira, Raúl Hestnes, "Arquitetura e Universidade-ISCTE", 2006		pagina_web	https://catalogo.biblioteca.iscte-iul.pt/cgi-bin/koha/opac-detail.pl?biblionumber=44777
2004050100	2004-05-01	União Europeia: adesão de Chipre, Eslováquia, Eslovénia, Estónia, Hungria, Letónia, Lituânia, Malta, Polónia, República Checa	Internacional	sim		Informação do MNE sobre as adesões da Chéquia, do Chipre, da Eslováquia, da Eslovénia, da Estónia, da Hungria, da Letónia, da Lituânia, de Malta e da Polónia à UE  		pagina_web	https://eurocid.mne.gov.pt/eventos/adesao-uniao-europeia-da-chequia-do-chipre-da-eslovaquia-da-eslovenia-da-estonia-da-4
2004012200	2004-01-22	Licenciamento inicial da plataforma e-learning Blackboard	Iscte	não	Prof. Jorge Freitas Branco				
2004051800	2004-05-18	Criação do doutoramento em Demografia	Iscte	sim	Deliberação n.º 652/2004, de 18 de maio in Diário da República, n.º 116, II Série, 18/05/2004, pp. 7560-61 - acessível em https://files.dre.pt/2s/2004/05/116000000/0756007561.pdf	Deliberação n.º 652/2004, de 18 de maio		documento	https://files.dre.pt/2s/2004/05/116000000/0756007561.pdf
2004052100	2004-05-21	Criação do Doutoramento em Serviço Social, em associação com o Instituto Superior de Serviço Social de Lisboa	Iscte	sim	Deliberação n.º 684/2004, de 21 de maio in Diário da República, n.º 119, II Série, 21/05/2004, pp. 7848-7850 - acessível em https://files.dre.pt/2s/2004/05/119000000/0784807850.pdf	Deliberação n.º 684/2004, de 21 de maio; Diário da República n.º 119/2004, Série II de 2004-05-21, páginas 7848 - 7850		documento	https://files.dre.pt/2s/2004/05/119000000/0784807850.pdf
2004111900	2004-11-19	Fim do serviço militar obrigatório	Nacional	sim		Artigo: Lembra-se do Serviço Militar Obrigatório? Acabou há dez anos		pagina_web	https://sol.sapo.pt/artigo/115226/lembra-se-do-servico-militar-obrigatorio-acabou-ha-dez-anos
2004070600	2004-07-06	Primeiro Doutoramento em Métodos Quantitativos, Maria Teresa Calapêz	Iscte	sim	Unidade de Apoio ao 3.º Ciclo				
2004112200	2004-11-22	Alojada na Biblioteca do ISCTE a antiga Biblioteca do Centro de Estudos Africanos	Iscte	sim	Gabinete da Reitora???, Protocolo referente à Biblioteca Central de Estudos Africanos (BCEA) concluído entre o Instituto Superior de Ciências do Trabalho e da Empresa (ISCTE) e o Centro de Estudos Africanos - ISCTE (CEA), Lisboa, 22/11/2004; https://bcea.cei.iscte-iul.pt/2020/08/biblioteca-central-de-estudos-africanos/	Página web da Biblioteca Central de Estudos Africanos		pagina_web	https://bcea.cei.iscte-iul.pt/2020/08/biblioteca-central-de-estudos-africanos/
2004122600	2004-12-26	Terramoto e sismo submarinos no Índico: 230.000 mortos	Internacional	sim		Notícia de tsunami no índico, 2004		pagina_web	https://g1.globo.com/mundo/noticia/2018/12/23/tsunami-no-final-de-2004-matou-230-mil-veja-lista-dos-principais-desastres-no-mundo.ghtml
2004121400	2004-12-14	Maria de Lurdes Rodrigues é Presidente do Conselho Científico (eleita)	Iscte	sim	Termo de Posse a 14-12-2004.				
2005021400	2005-02-14	Criação da plataforma Youtube	Internacional	sim		Vídeo: "A história do YouTube - TecMundo"		video	https://www.youtube.com/watch?v=SWjBd0yWqeg
2004123100	2004-12-31	Adesão à plataforma DeGóis para a gestão curricular de investigadores neste ano	Iscte	não	Prof. Jorge Freitas Branco				
2005021600	2005-02-16	Mário Leston Bandeira é Presidente do Conselho Pedagógico (reeleito)	Iscte	sim	Termo de Posse a 16-02-2005.				
2005022800	2005-02-28	Luís Antero Reto é presidente do ISCTE (eleito)	Iscte	sim	Termo de Posse a 28-02-2005.				
2005031200	2005-03-12	José António Vieira da Silva, ministro do Trabalho e da Solidariedade Social	Iscte	sim	Decreto do Presidente da República n.o 20/2005 de 12 de Março in Diário da República, n.º 50-A, II Série, 12/03/2005, p. 2168-(2) - acessíel em https://files.dre.pt/1s/2005/03/050aa00/00020003.pdf	Decreto do Presidente da República n.o 20/2005 de 12 de Março		documento	https://files.dre.pt/1s/2005/03/050aa00/00020003.pdf
2005031201	2005-03-12	Maria de Lurdes Rodrigues, ministra da Educação	Iscte	sim	Decreto do Presidente da República n.o 20/2005 de 12 de Março in Diário da República, n.º 50-A, II Série, 12/03/2005, p. 2168-(2) - acessível em https://files.dre.pt/1s/2005/03/050aa00/00020003.pdf	Decreto do Presidente da República n.º 20/2005, de 12 de março		documento	https://files.dre.pt/1s/2005/03/050aa00/00020003.pdf
2005033100	2005-03-31	Criação do doutoramento em Gestão	Iscte	sim	Despacho n.º 6732/2005 de 31 de março in Diário da República, n.º 63, II Série, 31/03/2005, pp. 5064-5065 - acessível em https://files.dre.pt/2s/2005/03/063000000/0506405065.pdf	Despacho n.º 6732/2005 de 31 de março	falta rectificação constante da Letícia Despacho n.º 6732/2005 (2.ª série), de 31 de março; Diário da República n.º 63/2005, Série II de 2005-03-31, páginas 5064 - 5065	documento	https://files.dre.pt/2s/2005/03/063000000/0506405065.pdf
2005042600	2005-04-26	Jorge Freitas Branco é presidente do Conselho Científico (eleito)	Iscte	sim	Termo de posse a 26-04-2005	Termo de posse		imagem	https://www.flickr.com/photos/iscteiul/52263477575/in/album-72177720298218822/
2005061300	2005-06-13	Morte de Álvaro Cunhal (1913-2005)	Nacional	sim		Notícia: Álvaro Cunhal - Líder histórico comunista morreu aos 91 anos		pagina_web	https://www.rtp.pt/noticias/pais/alvaro-cunhal-lider-historico-comunista-morreu-aos-91-anos_n11838
2005061000	2005-06-10	Ciberdúvidas alojado num servidor do ISCTE	Iscte	não	Prof. Jorge Freitas Branco				
2005071800	2005-07-18	Protocolo com o Instituto Superior Técnico relativo ao Sistema FénixEDU	Iscte	não	Prof. Jorge Freitas Branco				
2005123100	2005-12-31	Criação do AUDAX presidido por José Paulo Esperança neste ano	Iscte	sim	https://www.iscte-iul.pt/conteudos/iscte/quem-somos/12/historia-iscte, ponto 4	Audax		pagina_web	https://www.iscte-iul.pt/conteudos/iscte/quem-somos/12/historia-iscte
2006021300	2006-02-13	Primeiro Doutoramento em Direito das Empresas (descontinuado), Maria Adelaide Croca	Iscte	sim	Unidade de Apoio ao 3.º Ciclo				
2006022800	2006-02-28	Publicação de "Arquitetura e Universidade - ISCTE" (Raul Hestnes Ferreira)	Iscte	sim	Ferreira, Raúl Hestnes, "Arquitetura e Universidade- ISCTE", Lisboa, Librus Publicações Técnicas, 2006 - acessível em https://catalogo.biblioteca.iscte-iul.pt/cgi-bin/koha/opac-detail.pl?biblionumber=44777	Ferreira, Raúl Hestnes, "Arquitetura e Universidade- ISCTE", 2006		pagina_web	https://catalogo.biblioteca.iscte-iul.pt/cgi-bin/koha/opac-detail.pl?biblionumber=44777
2006051500	2006-05-15	Acesso à RTCS, Rede Ciência Tecnologia Sociedade (Internet)	Iscte	não	Prof. Jorge Freitas Branco				
2006061400	2006-06-14	 Adesão a Associação das Universidades de Língua Portuguesa (AULP)	Iscte	não	Prof. Jorge Freitas Branco		Carta da Associação dirigira do reitor Luís Reto, email JFB a FO  de 29/04/2022 00:06, na minha opinião deve ser validado		
2006072400	2006-07-24	Criação da Licenciatura em Ciência Política	Iscte	sim	Deliberação n.º 1239/2006 in Diário da República, n.º 181, II Série, 19/09/2006, pp. 19257-19260 - acessível em https://files.dre.pt/2s/2006/09/181000000/1925719260.pdf	Deliberação n.º 1239/2006 de 19 de Setembro		documento	https://files.dre.pt/2s/2006/09/181000000/1925719260.pdf
2006080800	2006-08-08	Constituição da Fundação ISCTE (prestadora de serviços)	Iscte	não	Prof. Jorge Freitas Branco				
2006091900	2006-09-19	Criação do Doutoramento em Gestão Empresarial Aplicada	Iscte	sim	Deliberação n.º 1238/2006 in Diário da República, n.º 181, II Série, 19/09/2006, pp. 19254-19257 - acessível em https://files.dre.pt/2s/2006/09/181000000/1925419257.pdf	Deliberação n.º 1238/2006, de 19 de setembro		documento	https://files.dre.pt/2s/2006/09/181000000/1925419257.pdf
2006102600	2006-10-26	Adesão a European University Association (EUA)	Iscte	não	Prof. Jorge Freitas Branco		"Carta da associação a Luís Reto, email de JFB a FO de 29/04/2022 00:10". Penso que deve ser validado pois esta informação veio do Gabinete da Reitora para JFB e foi depois reencaminhada para mim.	pagina_web	https://eua.eu/about/member-directory.html
2007010100	2007-01-01	União Europeia: adesão da Bulgária e da Roménia	Internacional	sim		Vídeo: "SAVE THE DATE: 15 years of EU membership of Bulgaria and Romania – taking stock"		video	https://www.youtube.com/watch?v=fdLlKdtsdfA
2006103100	2006-10-31	Acesso público ao Repositório Institucional do ISCTE neste mês	Iscte	sim	https://repositorio.iscte-iul.pt/handle/10071/606	Repositório Institucional do ISCTE		pagina_web	https://repositorio.iscte-iul.pt/handle/10071/606
2007010200	2007-01-02	Lançamento de notas na plataforma Fénix	Iscte	não	Prof. Jorge Freitas Branco				
2007021500	2007-02-15	Sílvia Silva é presidente do Conselho Pedagógico (eleita)	Iscte	sim	Termo de Posse a 15-02-2007.	Termo de posse		imagem	https://www.flickr.com/photos/iscteiul/52013834692/in/album-72177720298218822/
2007051500	2007-05-15	Carlos Sá da Costa é presidente do Conselho Científico (eleito)	Iscte	sim	Termo de Posse a 15-02-2007.	Termo de posse		imagem	https://www.flickr.com/photos/iscteiul/52263477545/in/album-72177720298218822/
2007071000	2007-07-10	Acordo de cooperação técnico-financeiro ISCTE-OIT-IEFP-UGT-CGTP	Iscte	sim	Gabinete da Reitora???, Acordo de Cooperação entre ISCTE Fundação ISCTE Escritório da OIT em Lisboa Instituto de Emprego e Formação Profissional Confederação Geral dos Trabalhadores Portugueses União Geral de Trabalhadores, sem data [02/04/2007]; Despacho nº6/208 do Presidente do ISCTE, 03/03/2008				
2007080100	2007-08-01	Protocolo com a Universidade de Ciências e Tecnologia de Macau	Iscte	não	Prof. Jorge Freitas Branco		Protocolo com a Universidade de Ciências e Tecnologia de Macau de 18 de maio de 2011. Novamente a questão das fontes terciárias e da decisão "superior"..		
2007091000	2007-09-10	Novo Regime Jurídico das Instituições do Ensino Superior (RJIES)	Nacional	sim	Lei nº 62/2007 in Diário da República, n.º 174, I Série, 10/09/2007, pp. 6358-6389	Novo Regime Juridico no Diario da Republica		documento	https://files.dre.pt/1s/2007/09/17400/0635806389.pdf
2007110500	2007-11-05	Criação da Agência de Avaliação e Acreditação do Ensino Superior (A3ES)	Nacional	sim	Decreto-Lei n.º 369/2007 de 5/11 in Diário da República, n.º 212, I Série, 05/11/2007, pp. 8032-8040	Decreto-Lei n.º 369/2007 		documento	https://files.dre.pt/1s/2007/11/21200/0803208040.pdf
2007090101	2007-09-01	Os estudantes do ISCTE passam a poder alojar-se na residência universitária Prof. José Pinto Peixoto	Iscte	sim	Núcleo de Apoio Técnico e Secretariado, Núcleo Expediente e Arquivo???, "Protocolo de transferência de gestão da Residência Universitária Professor José Pinto Peixoto", 01/08/2007				
2007121500	2007-12-15	Publicação de "ISCTE 35 anos. Nascido para inovar" (organizado por Carlos Oliveira Santos, Luísa Tiago de Oliveira e Jorge Freitas Branco)	Iscte	sim	Santos, Carlos Oliveira, Luísa Tiago de Oliveira e Jorge Freitas Branco (orgs.), "ISCTE 35 anos. Nascido para inovar", Lisboa, ISCTE, 2007 - acessível em https://repositorio.iscte-iul.pt/handle/10071/2157	Santos, Carlos Oliveira, Luísa Tiago de Oliveira e Jorge Freitas Branco (orgs.), "ISCTE 35 anos. Nascido para inovar", 2007		pagina_web	https://repositorio.iscte-iul.pt/handle/10071/2157
2007123100	2007-12-31	Criação do Centro em Rede de Investigação em Antropologia (CRIA) neste ano	Iscte	sim	https://www.cria.org.pt/pt/apresentacao	Página web do Centro em Rede de Investigação em Antropologia (CRIA)		pagina_web	https://www.cria.org.pt/pt
2007123101	2007-12-31	Criação do Gabinete de Avaliação e Qualidade do Ensino neste ano	Iscte	sim	"GaQE - News" nº 1, fev 2008				
2008050700	2008-05-07	Criação do Observatório da Emigração	Nacional	sim	http://observatorioemigracao.pt/np4/1308; https://www.publico.pt/2008/05/07/sociedade/noticia/observatorio-da-emigracao-e-instituido-hoje-pelo-governo-e-iscte-1327966	Notícia sobre a criação do Observatório da Emigração		pagina_web	https://www.publico.pt/2008/05/07/sociedade/noticia/observatorio-da-emigracao-e-instituido-hoje-pelo-governo-e-iscte-1327966
2008010700	2008-01-07	Eleição da Assembleia estatutária, destinada a decidir a passagem para o regime fundacional e a elaborar os novos estatutos no âmbito do Regime Jurídico das Instituições do Ensino Superior, com a presença do ministro Mariano Gago	Iscte	sim	Fotografia do evento, 7/1/2008	Assembleia estatutária com a presença do ministro Mariano Gago		imagem	https://www.flickr.com/photos/iscteiul/52015377995/in/album-72177720298218822/
2008053100	2008-05-31	Desmaterialização do Inquérito de monitorização pedagógica (1º ciclo)	Iscte	não	Prof. Jorge Freitas Branco		Informação prestada por telefone e email por JOão Oliveira. Pedidos foram encaminhados mas indica que será muito difícil conseguir as informações. Aguardar JO		
2008073100	2008-07-31	Neste ano e no anterior, tinham sido adequados ao modelo de Bolonha 14 cursos de licenciaturas, 27 mestrados e 6 doutoramentos	Iscte	sim	Unidade de Gestão Curricular				
2008082100	2008-08-21	Nelson Évora ganha medalha de ouro olímpica em Pequim	Nacional	sim		Artigo: Nelson Évora salta para o ouro na Pequim 2008		pagina_web	https://olympics.com/pt/video/nelson-evora-salta-para-o-ouro-na-pequim-2008
2008080800	2008-08-08	Criação da Licenciatura em Finanças e Contabilidade (fusão da Licenciatura em Finanças e da Licenciatura em Contabilidade)	Iscte	sim	Despacho n.º 21650/2008 in Diário da República, n.º 159, II Série, 19/08/2008, pp. 36606-36608 - acessível em https://files.dre.pt/2s/2008/08/159000000/3660636608.pdf	Despacho n.º 21650/2008 - Diário da República n.º 159/2008, Série II de 2008-08-19 (Fusão dos dois), pp. 36606		documento	https://files.dre.pt/2s/2008/08/159000000/3660636608.pdf
2008090100	2008-09-01	Desmaterialização das inscrição dos estudantes	Iscte	não	Prof. Jorge Freitas Branco		Questão colocada a JO sobre a automatização plena das inscrições do 1, 2 e 3 ciclo. aguardar info de JO		
2008102900	2008-10-29	Criação do Programa Interuniversitário de Doutoramento em História, em associação com a Universidade de Lisboa (Instituto de Ciências Sociais e Faculdade de Letras), a Universidade de èvora e a Universidade Católica	Iscte	sim	Deliberação n.º 2849/2008 in Diário da República, n.º 210, II Série, 29/10/2008, pp. 43969-43973 - acessível em https://files.dre.pt/2s/2008/10/210000000/4396943973.pdf			documento	https://files.dre.pt/2s/2008/10/210000000/4396943973.pdf
2008123100	2008-12-31	Criação do Observatório das Desigualdades neste ano	Nacional	sim	https://ciencia.iscte-iul.pt/projects/observatorio-das-desigualdades/51; https://cies.iscte.pt/np4/171/	Link do website do Observatório das Desigualdades 		pagina_web	https://www.observatorio-das-desigualdades.com/e-working-papers-od/
2008103100	2008-10-31	Adesão à rede Eduroam	Iscte	não	Prof. Jorge Freitas Branco		Informação prestada por telefone e email por JOão Oliveira. Pedidos foram encaminhados mas indica que será muito difícil conseguir as informações. Aguardar info de JO	imagem	https://www.flickr.com/photos/iscteiul/52015377870/in/album-72177720298218822/
2008123101	2008-12-31	Remodelação do pátio interior (1870 m2) do Edifício Sedas Nunes neste ano	Iscte	sim	Baltazar, João, "ISCTE-IUL. Arquitetura e universidade. 2005-2015. Uma década de intervenções no campus", Lisboa, ISCTE, 2016, p. 16 - acessível em https://catalogo.biblioteca.iscte-iul.pt/cgi-bin/koha/opac-detail.pl?biblionumber=100811	Baltazar, João, "ISCTE-IUL. Arquitetura e universidade. 2005-2015. Uma década de intervenções no campus", 2016		pagina_web	https://catalogo.biblioteca.iscte-iul.pt/cgi-bin/koha/opac-detail.pl?biblionumber=100811
2008123102	2008-12-31	Certificação de Qualidade neste ano	Iscte	sim	Gabinete de Estudos, Planeamento e Qualidade, APCER, "Relatório de Auditoria efetuada a 22,23 e 24 de 2012 de 2008" -  ISO 9001:2008	Certificação de Qualidade		pagina_web	https://www.iscte-iul.pt/conteudos/iscte/qualidade/acreditacoes-rankings/certificacao-sistema-sigqiul/1185/certificacoes-iso
2008123102	2008-12-31	Certificação de Qualidade neste ano	Iscte	sim	Gabinete de Estudos, Planeamento e Qualidade, APCER, "Relatório de Auditoria efetuada a 22,23 e 24 de 2012 de 2008" - ISO 9001:2008				
2009021800	2009-02-18	 Senado aprova mudança de imagem	Iscte	não	Prof. Jorge Freitas Branco				
2009042300	2009-04-23	Criação do Doutoramento em História, Defesa e Relações Internacionais, em associação com a Academia Militar	Iscte	sim	Deliberação n.º 1199/2009 de 23 de abril in Diário da República, n.º 79, II Série, 23/04/2009, pp. 16448-16450 - acessível em https://files.dre.pt/2s/2009/04/079000000/1644816450.pdf	Deliberação n.º 1199/2009, de 23 de abril		documento	https://files.dre.pt/2s/2009/04/079000000/1644816450.pdf
